Name,Reviews_Count,Followers,Rating,Review,Processed_Review,Sentiment,Issue_Category,Topic
Arwa Noorani,0 reviews,4 Followers,5.0,Great vibe and amazing hot chocolate. Asif and Sonalika made it a point to offer a fun and pleasant service! :),great vibe amazing hot asif sonalika made point offer fun pleasant,Positive,General,Service
Sujash Baid,0 reviews,113 Followers,5.0,Great service and amazing coffee - Asif was attentive,great service amazing coffee asif attentive,Positive,"Service, Food Quality",Service
Radhika Sachdev,0 reviews,79 Followers,5.0,"As always great coffee! the service was extremely good, thanks to Asif... Very humble..",always great service extremely thanks,Positive,Service,Location
Srishti Agrawal,0 reviews,0 Followers,5.0,"Asif- Good service, amazing coffee",good amazing coffee,Positive,Food Quality,Service
Khushi Agrawal,0 reviews,0 Followers,5.0,Asif it’s was an amazing taste and the service of nice.,asif amazing taste service,Positive,Service,Service
Kamyaa Chaturvedi,0 reviews,0 Followers,5.0,"Asif, our server was incredibly kind and attentive. Had a good time!",server incredibly kind good,Positive,General,Service
Jiya Thakkar,0 reviews,0 Followers,5.0,"Great hospitality by Asif,",great hospitality,Positive,General,Location
Suvansh Agarwal,0 reviews,0 Followers,5.0,Asif was really good,asif really good,Positive,General,Service
Kanchi Agrawal,0 reviews,42 Followers,5.0,The service was really good. Specially do ask for asif he gives amazing service.,service really specially ask asif gives amazing,Positive,Service,Service
Parth Chheda,0 reviews,36 Followers,5.0,Asif great service,asif great service,Positive,Service,Service
Arijeet Singh,0 reviews,0 Followers,5.0,Asif bro was amazing,asif bro amazing,Positive,General,Service
Tanya,0 reviews,0 Followers,5.0,Asif was our server really good service and great coffee and food. Love it.,asif server really good service great coffee love,Positive,"Service, Food Quality",Service
Dhanush K,0 reviews,1 Followers,5.0,"asif was a lovely server, and great coffee",asif lovely great coffee,Positive,Food Quality,Location
Raunak,0 reviews,2 Followers,5.0,The coffee was good. Great service by Asif Sheikh! Would recommend totally!,coffee great service asif would recommend,Positive,"Service, Food Quality",Service
Jayanti Dhawan,0 reviews,1 Followers,5.0,I have been here a lot since I arrived in Bombay … nice ambience… nice atmosphere and coffee too amazing.. it’s like a CENTRAL PERK for me and my friends.. iykyk and Ashif here is such a good person. Love to recommend it to others..,lot since arrived bombay nice nice atmosphere coffee like central perk iykyk ashif good love recommend,Positive,Food Quality,Timing
Prity Agarwal,0 reviews,0 Followers,5.0,Great service by Asif and Sonalika,great service asif sonalika,Positive,Service,Service
Aditya Poddar,0 reviews,7 Followers,5.0,Great hospitality from Asif and sonalika,great hospitality asif sonalika,Positive,General,Service
Natasha Malhotra,0 reviews,0 Followers,5.0,,nan,Neutral,General,Food
Farida,0 reviews,0 Followers,5.0,Moin suggested us the coffee named South Indian frappe which was outstanding and amazing enjoyed a lot willing to visit again for sure,moin suggested us coffee named south indian frappe outstanding amazing enjoyed lot willing visit sure,Positive,Food Quality,Food
Dhwani Thakkar,0 reviews,0 Followers,5.0,"Moin served us; great iced latte; outstanding ambience ,Europe vibe to the cafe.",moin served great iced outstanding ambience vibe,Positive,Location,Location
Samyak Kochar,0 reviews,0 Followers,5.0,Good service by Manoj,good service manoj,Positive,Service,Service
Bhoomika Wadhwani,0 reviews,0 Followers,5.0,"the food as well as the coffee was very worthy and tasty, also the staff is very kind and friendly.",food well coffee worthy also staff kind,Positive,"Service, Food Quality",Service
Utsah Agrawal,0 reviews,0 Followers,5.0,Asif/sonalika served us very well. Vietnamese coffee and burliner were great,served us vietnamese coffee burliner great,Positive,Food Quality,Location
Priyanshi Somani,0 reviews,0 Followers,5.0,Asif and Sonalika were great at the services and always on their toes for us. Loved the experience,asif sonalika great services always toes loved experience,Positive,Service,Service
Himanshu Kumar,0 reviews,1 Followers,5.0,"Had a great experience here, complementary snacks as well, Asif and Sonalika were wonderful :)",great experience complementary snacks asif sonalika wonderful,Positive,General,Service
Shivani,0 reviews,1743 Followers,5.0,Asif and Sonalika were very friendly and helpful. The place has a good vibe and their hospitality made it a comfortable evening to catch up with friends,asif sonalika friendly place good vibe hospitality made comfortable evening catch friends,Positive,"Service, Location",Service
Diya Lulla,0 reviews,185 Followers,5.0,"Asif and Sonalka were really nice. They gave us the best service. Overall, it’s the best place!",asif sonalka really gave us best best,Positive,General,Service
Sanchit Agarwal,0 reviews,0 Followers,5.0,Asif and Sonalika are extremely helpful and friendly.,asif sonalika extremely helpful,Negative,General,Service
Anukratidosi,0 reviews,2 Followers,5.0,"Asif and Sonalika made sure we had a good time, and beverage to our liking",asif sonalika made sure good beverage liking,Positive,General,Service
Aditivaishnav,0 reviews,0 Followers,5.0,Asif was really good,asif really good,Positive,General,Service
Avnishbahadur,0 reviews,1 Followers,5.0,"Asif/sonalika had great knowledge about coffee and the menu and were Very courteous. Great coffee, food, ambiance and hospitality.",great knowledge coffee menu great ambiance,Positive,Food Quality,Location
Anurag,0 reviews,78 Followers,5.0,"One of a kind 24x7 cafe in Juhu, with outdoor seating on walkway to enjoy evening during Bombay winters. Well priced coffee and great staff; specially Asif who has been helpful on our every visit.",one kind cafe outdoor seating walkway enjoy evening bombay well priced coffee great specially asif helpful every,Positive,Food Quality,Service
Chris Mathai,0 reviews,39 Followers,5.0,amazing place especially our server asif was very helpful,amazing place especially server asif helpful,Positive,Location,Service
Sampada Chaudhari,0 reviews,0 Followers,5.0,"Had great experience at etara coffee
Great service from Sonalika. & asif",great experience etara coffee great service asif,Positive,"Service, Food Quality",Service
Dhruvi Kothari,0 reviews,0 Followers,5.0,Asif and Sonalika were great with the service and were very sweet,asif sonalika great service sweet,Positive,Service,Service
Vartika,0 reviews,3 Followers,5.0,Asif and Sonalika - They served us well and were very kind. The food is very good. Must visit.,asif sonalika served us well food must,Neutral,Food Quality,Service
Vedant Tibrewala,0 reviews,16 Followers,5.0,"Asif and Sonalika were our servers and they were really sweet, prompt and helpful. Great quality of coffee and food. It's one of the best coffee shops I've been to in mumbai. Would highly recommend.",asif sonalika servers really prompt great quality coffee one best coffee shops would highly,Positive,Food Quality,Service
Ishit Lapsiya,0 reviews,0 Followers,5.0,Asif and sonalika gave best service!!,asif sonalika gave best,Positive,General,Service
Siddarth Shrikhande,0 reviews,4 Followers,5.0,Asif and Sonalika from Ettarra provide the best service and coffee place in Mumbai,asif sonalika ettarra provide best service coffee place mumbai,Positive,"Service, Food Quality, Location",Service
Dipen Parekh,0 reviews,0 Followers,5.0,ASIF SONALIKA gave great service and made our experience enjoyable,asif sonalika gave great service made experience enjoyable,Positive,Service,Service
Nidhi Pawar,0 reviews,1 Followers,5.0,Loved the vibe. Manoj is very helpful and kind. Good service.,loved manoj helpful good,Positive,General,Service
Jahanvi Arya,0 reviews,0 Followers,5.0,"great service, great atmosphere and great service, especially by our Manoj bhaiya, he is really helpful and sweet in the way he goes about catering to the customers.",great great atmosphere great especially manoj really helpful sweet way goes catering,Positive,General,Location
Avani Patel,0 reviews,0 Followers,5.0,thank you for giving good coffee and food very nice service by Manoj,thank giving good coffee food nice service manoj,Positive,"Service, Food Quality",Service
Rushabh Patel,0 reviews,10 Followers,5.0,I visited this place with my friend and the server name Asif give me great recommendations and treat us very nicely,visited place friend server name asif give great recommendations treat us nicely,Positive,Location,Service
Sneha,0 reviews,0 Followers,5.0,"Lovely experience, great coffee great staff. Special thanks to Asif sheikh so friendly and sweet",lovely great coffee great special thanks asif sheikh friendly sweet,Positive,"Service, Food Quality",Location
Dhriti,0 reviews,0 Followers,5.0,Asif was very helpful and great service provided,asif helpful great service provided,Positive,Service,Service
Alice,0 reviews,0 Followers,5.0,"Had a really great time at ettarra and the service was amazing. Asif was a great help to recommend some of the best stuff on menu . also ICED americano is must try, here .",really great time ettarra service asif great help recommend best stuff menu also iced americano must,Positive,Service,Service
Achsah,0 reviews,0 Followers,5.0,"loved the cold coffee, specially how flavourful it was. really grateful to Asif for recommending the coffee! the ambiance is amazing",loved cold specially flavourful really grateful asif recommending ambiance amazing,Positive,General,Service
Chandni Sabnani,0 reviews,23 Followers,5.0,Mr. Asif gave us very good service. thank you,asif gave us good thank,Positive,General,Service
Ronit Sarawgi,0 reviews,66 Followers,5.0,"My go to spot with friends, Asif Shaikh has always helped us! Great service and hospitality!",go spot asif shaikh always helped great service,Positive,Service,Service
ANVI AGGARWAL,0 reviews,0 Followers,5.0,"Asif, very nice service, and handling",nice handling,Positive,General,Timing
Dhiaa Navlani,0 reviews,0 Followers,5.0,"Asif/Sonalika
We loved the service of the individual they greeted us the best we loved the food as well",loved service individual greeted us best loved food well,Positive,"Service, Food Quality",Service
Abhiraj,0 reviews,0 Followers,5.0,Asis was amazing,asis amazing,Positive,General,Service
Gurpreet Saini,0 reviews,0 Followers,5.0,Sonalika made great coffee. Asif’s service is great,sonalika made great service great,Positive,Service,Service
Nitika Jain,0 reviews,0 Followers,5.0,"Great ambience
Asif was very courteous and nice
Sonalika made amazing coffee",great ambience asif courteous nice sonalika made amazing coffee,Positive,"Food Quality, Location",Service
Akshita Jain,0 reviews,0 Followers,5.0,Really great service! Thanks Asif for the hospitality,really great thanks asif hospitality,Positive,General,Location
Naisha Soni,0 reviews,0 Followers,5.0,"Amazing place with a very friendly staff, and a very good service by Asif, would. recommend all my friends to come here:)",amazing place friendly good service recommend friends come,Positive,"Service, Location",Service
Mayank Prashar,0 reviews,0 Followers,5.0,Had a great coffee .Asif made sure that we have a comfortable time here,great coffee made sure comfortable time,Positive,Food Quality,Food
Juhi Khandelwal,0 reviews,0 Followers,5.0,"“Great service! The staff was friendly, attentive, and asif ensured a seamless coffee experience. Will definitely visit again!”",staff asif ensured seamless coffee definitely visit,Positive,"Service, Food Quality",Service
Paras Shah,0 reviews,3 Followers,5.0,"The experience is amazing. The coffees which we tried were very good and their concept of giving a sample to taste the coffee before serving is great so as to we can make changes in the drink if we want. Mahesh was a great server and was kind and helful throughout.
Amazing experience in all.",experience coffees tried good concept giving sample taste coffee serving great make changes drink mahesh great server kind helful amazing experience,Positive,Food Quality,Service
Isha Shah,0 reviews,13 Followers,5.0,we like the place and the ambience. the coffee tat we ordered was really good. that was recommended by asif .he was very cordial ..👍,like place coffee tat ordered really recommended asif cordial,Positive,"Food Quality, Location",Food
Ashutosh Anwane,0 reviews,1 Followers,5.0,"Asif shaikh he suggest really nice coffee and tasted good as well , very much recommended",asif shaikh suggest really nice coffee tasted good well much recommended,Positive,Food Quality,Service
Sana,0 reviews,1 Followers,5.0,"The coffee here is absolutely amazing. A taste that would want you to keep coming back for more. Definitely my favourite place from now on. Miss Sonalika was so polite and her recommendation after listening to my interests was spot on, going to Make it my regular coffee order!",coffee absolutely taste would want keep coming back definitely favourite place miss sonalika polite recommendation listening interests spot going make regular coffee,Positive,"Service, Food Quality, Location",Food
Rashi,0 reviews,0 Followers,5.0,excellent service by ASIF,excellent service asif,Positive,Service,Service
Dev,0 reviews,0 Followers,5.0,Great food and service. Thank you Asif,great food thank asif,Positive,Food Quality,Service
Manish Ladda,0 reviews,24 Followers,5.0,"Manoj bhaiya was amazing, his service was great.
Food was very tasty",manoj bhaiya service food tasty,Neutral,"Service, Food Quality",Service
Subhansu,0 reviews,138 Followers,5.0,"Great coffee
Great staff
Thanks Asif for great service",great coffee great staff thanks asif great service,Positive,"Service, Food Quality",Service
Keshav Garg,0 reviews,2 Followers,5.0,asif and sonalika were very nice. had a great experience. the coffee tastes amazing,asif sonalika great coffee tastes amazing,Positive,Food Quality,Service
Harshil Chopra,0 reviews,0 Followers,5.0,Manoj was the best person available for your service at ettarra,manoj best person available service ettarra,Positive,Service,Service
Japneet Kaur,0 reviews,0 Followers,5.0,"It was a nice experience here, and the coffee is affordable and delicious. Thanks, Mr. Ashish and Mr. Manoj for helping me with my experience and also through guiding me",nice experience coffee affordable ashish manoj helping experience also guiding,Positive,Food Quality,Location
Parakh,0 reviews,3 Followers,5.0,Great service by Asif,great service asif,Positive,Service,Service
Hasti Irani,0 reviews,0 Followers,5.0,Asif /sonalika server is great,asif server great,Positive,General,Service
Shaunak Deshpande,0 reviews,1 Followers,5.0,"Good Place, Grate vibe, Great service. especially Asif and sonalika were very sweet.",good grate great especially asif sonalika,Positive,General,Service
Spruha Karmore,0 reviews,1 Followers,5.0,Very good coffeee n even better service by Asif!!,good coffeee n even better service,Positive,"Service, Food Quality",Service
Anmay Motghare,0 reviews,0 Followers,5.0,"Its been a great place , had an amazing experience , aasif and recommendations were great , must visit!",great place amazing experience aasif recommendations great must,Positive,Location,Service
Mahika Taneja,0 reviews,0 Followers,5.0,"Asif/ Sonalika their service was the best
We loved the classic frape and the baked vada pav and baked pav bhaji were amazing .",sonalika service best loved classic frape baked vada pav baked pav bhaji amazing,Positive,Service,Food
Manasi Mishra,0 reviews,0 Followers,5.0,"It has been my go to place for a while now. Love the coffee. Food is good too. And the staff is just too sweet, especially Asif and Sonalika, they're are always ready to recommend the best!",go place love food good staff especially asif always ready recommend,Positive,"Service, Food Quality, Location",Service
Udisha,0 reviews,0 Followers,5.0,Asif was really helpful and sweet!,asif really helpful,Positive,General,Service
Devanshi,0 reviews,0 Followers,5.0,"Good food, good service
Thankyou asif for great service",good good service thankyou asif great service,Positive,Service,Service
Rajvansh Singh Hora,0 reviews,0 Followers,5.0,i had an amazing experience. the service provided by asi sheikh was excellent!!,amazing service provided asi sheikh,Positive,Service,Service
Santosh Agrawal,0 reviews,0 Followers,5.0,I had an amazing experience. Thanks to asi sheikh!!,amazing thanks asi,Positive,General,Location
Suhana Sacheti,0 reviews,0 Followers,5.0,Asif gave us really good service and was very helpful,asif gave us really good service helpful,Positive,Service,Service
Suman,0 reviews,2 Followers,5.0,"Great place.. Good vibe
The place has good food and excellent coffee options. Loved their original south indian frappe
Asif was great with his recommendations! Must visit",great good vibe place good food excellent coffee loved original south indian frappe asif great must visit,Positive,"Food Quality, Location",Service
Megha Agarwal,0 reviews,0 Followers,5.0,"The staffs are very rude, they don’t know how to talk to the customers, we celebrated our friends birthday taking permission, they themselves allowed us, and then they say you can just cut the cake but can’t eat it here, secondly they complained and asked for extra money just because there were cakes lying down on the floor. Need to look after the staff service they provide.",staffs know talk celebrated friends birthday taking allowed say cut cake eat secondly complained asked extra money cakes lying need look staff service,Positive,Service,Food
Tanvi Panpalia,0 reviews,0 Followers,5.0,Good service by Asim,good service asim,Positive,Service,Timing
Paridhi,0 reviews,2 Followers,5.0,"Amazing coffee, even better service! Special thanks to our server Asif Sheikh🙌",amazing even better special thanks server asif,Positive,General,Service
Harsha Somani,0 reviews,0 Followers,5.0,"Amazing place, great coffee! good service by asif!",amazing great good service,Positive,Service,Service
Ayushi,0 reviews,0 Followers,5.0,"Had a lovely experience.
Here Asif and Sonalika are the nicee guyysss .",lovely asif sonalika nicee guyysss,Positive,General,Service
Rounak Golchha,0 reviews,0 Followers,5.0,Had a lovely experience with Asif and Sonalika..,lovely experience asif,Positive,General,Location
Riya Patodia,0 reviews,0 Followers,5.0,"Had a really great experience. Loved the coffee here. Asif, Manoj and Sonalika were the sweetest.",really great loved coffee manoj sonalika,Positive,Food Quality,Service
Siya,0 reviews,0 Followers,5.0,"I recently visited this coffee shop, and I must say, Manoj made the experience exceptional. From the moment I walked in, his warm smile and friendly demeanor made me feel right at home Manoj's attention to detail, from the presentation of the drink to ensuring my comfort, was much appreciated. It's rare to find service that makes you want to return as much as the coffee itself, but Manoj's genuine care for customers truly sets this place apart.",recently visited coffee must manoj made experience moment walked warm smile friendly demeanor made feel right home attention presentation drink ensuring much rare find service makes want return much coffee genuine care customers truly sets place,Positive,"Service, Food Quality, Location",Food
Aagya Mutha,0 reviews,5 Followers,5.0,Manoj did a good job,manoj good job,Positive,General,Timing
Manan,0 reviews,0 Followers,5.0,Great place for coffee..,great place,Positive,Location,Location
Siddhi Motipara,0 reviews,0 Followers,5.0,"The coffee is damn nice, manoj’s service is great",coffee damn service great,Positive,"Service, Food Quality",Service
Mahima Hasija,0 reviews,0 Followers,5.0,"love this place ! we go here all the time, the ambience is so comforting and the staff are all so friendly we want to keep coming back- thanks to Mr Manoj for his professionalism and our favourite dearest Miss Shonalika who never fails to greet us with a smile ! lots of love",love place go ambience comforting staff friendly want keep coming thanks mr manoj professionalism favourite dearest miss shonalika never fails greet us smile lots love,Positive,"Service, Location",Location
Ravina Keni,0 reviews,0 Followers,5.0,"This cafe is cosy , a place where you can go to chill.
I tried their baked vadapav , benne croissant, donut , coffee.
I loved the south indian touch to the dishes , complementary banana chips were just a wow element.

Asif provided us with the best of service , the place itself has a good service system.
Asif suggested us the best of dishes and also provided small coffee shots to taste so we can the best coffee just how we like it.

Their coffee is a must try!",cafe cosy place go tried baked vadapav benne donut loved south indian touch dishes complementary banana chips wow asif provided us best service place good service asif suggested us best dishes also provided small coffee shots taste best coffee like coffee must,Positive,"Service, Food Quality, Location",Service
Parag Rochwani,0 reviews,0 Followers,5.0,Very kind nature from your staff mr manoj and really very good taste of the coffee,kind nature staff mr manoj really good taste coffee,Positive,"Service, Food Quality",Location
Anuja Das,0 reviews,0 Followers,5.0,Manoj good coffee,manoj good coffee,Positive,Food Quality,Service
Aayush Bhandari,0 reviews,0 Followers,5.0,Manoj bhai is very Good person,manoj bhai good person,Positive,General,Service
Pratik Sharma,0 reviews,4 Followers,5.0,"Manoj ji was an amazing host, loved the coffee and the baked Vada pav! Loved the hospitality as well, must visit!",manoj ji amazing loved coffee baked vada loved hospitality must,Positive,Food Quality,Food
Akalpita Asudani,0 reviews,0 Followers,5.0,Great service by Asif,great service asif,Positive,Service,Service
Mariya,0 reviews,5 Followers,5.0,Really cute ambience. Manoj helped us get a table quickly and was very attentive,really cute manoj helped us get table quickly attentive,Positive,Timing,Timing
Jash Chhajed,0 reviews,10 Followers,5.0,Mr. Manoj serves amazing coffee at this cafe. Please go and try,manoj serves amazing coffee please go try,Positive,Food Quality,Service
Jash Shah,0 reviews,0 Followers,4.0,"The best coffee spot with exceptional service provided by the server, Mañoj Pandit.",best coffee spot exceptional service provided mañoj,Positive,"Service, Food Quality",Service
Mohnish Rander,0 reviews,0 Followers,4.0,Best coffee house in bombay and loved the service by manoj pandit bhaiya ! He really treated us very well,best coffee house bombay loved service manoj pandit bhaiya really treated us well,Positive,"Service, Food Quality",Service
Naman Gandhi,0 reviews,0 Followers,4.0,"Good place for berliners
I truly recommend this place for sweets,berliners and coffee in juhu
great service by manoj.",good place berliners truly recommend place coffee juhu great service,Positive,"Service, Food Quality, Location",Service
Laksh Mehta,0 reviews,0 Followers,4.0,Great service by Manoj Bhai,great service manoj bhai,Positive,Service,Service
Nitish Paswan,0 reviews,0 Followers,4.0,Manoj Hot chocolate 👍💯,manoj hot chocolate,Positive,General,Location
Kanay Gandhi,0 reviews,2 Followers,5.0,"Delicious hot chocolate
great service by Manoj",delicious hot chocolate great service manoj,Positive,"Service, Food Quality",Location
Abdur Rehman,0 reviews,0 Followers,5.0,Manoj was very helpful in catering and the coffee was amazing,manoj helpful catering coffee amazing,Positive,Food Quality,Service
Hridaygulati277,0 reviews,2 Followers,5.0,"Great vibe and food, Manoj was very helpful and kind in his service",great vibe manoj helpful kind service,Positive,Service,Service
Rinkal Bhatia,0 reviews,313 Followers,5.0,Manoj the man goes out of his way to serve and make it the most beautiful experience at the coffee shop.,manoj man goes way serve make beautiful experience coffee,Positive,Food Quality,Location
Nirroze Putcha,0 reviews,78 Followers,5.0,Manoj has given amazing service thank you Manoj,manoj given amazing service thank manoj,Positive,Service,Service
Tharun Bangera,0 reviews,0 Followers,5.0,"Manoj's service was amazing, and that hot chocolate? Easily the best I've had in a long time!",service hot easily best long,Positive,"Service, Timing",Service
Rohit Kanchan,0 reviews,142 Followers,5.0,"Chill place , must try Narilyal cascarra, warm treatment by staff , Manoj",chill place must try narilyal warm treatment staff manoj,Positive,"Service, Location",Location
Ananya Khetan,0 reviews,0 Followers,5.0,Love the coffee and great service of manoj,love coffee great service manoj,Positive,"Service, Food Quality",Service
Aish Jain,0 reviews,0 Followers,5.0,Great service by Manoj nice place great value coffee,great service manoj nice place great value coffee,Positive,"Service, Food Quality, Location",Location
Nimit Patel,0 reviews,0 Followers,5.0,Your staff manoj is amazing,staff manoj amazing,Positive,Service,Location
Gaurav,0 reviews,0 Followers,5.0,Absolutely love this places. Manoj is a great guy and gives the best service at ettara…,absolutely love manoj great guy gives best service,Positive,Service,Service
Vasudha,0 reviews,0 Followers,5.0,"Amazing coffee and variety of options. A perfect place to sit & talk & chill. Staff is incredible, especially manohar, to select the right taste if you’re indecisive",amazing coffee variety perfect place sit talk staff especially select right taste indecisive,Positive,"Service, Food Quality, Location",Location
Pranay,0 reviews,0 Followers,5.0,Asif was an excellent host. and the coffee is excellent,asif excellent coffee excellent,Positive,Food Quality,Service
Yash Raj Singh,0 reviews,214 Followers,5.0,,nan,Neutral,General,Food
