Name,Reviews_Count,Followers,Rating,Review,Processed_Review,Sentiment,Issue_Category,Topic
Rishikesh Khedkar,0 reviews,0 Followers,1.0,Bad service,bad service,Negative,Service,Service
Kajal Jain,0 reviews,0 Followers,4.0,Great service and good,great service good,Positive,Service,Service
Naman Upadhyaya,0 reviews,24 Followers,5.0,"Asif shaikh- The best coffee shop in Mumbai with Polite and good staff ,serving food with complimentary banana chips and water.😍",asif best coffee shop mumbai polite good staff food complimentary banana chips,Positive,"Service, Food Quality",Location
Gauravchettiyar13@gmail.com,0 reviews,0 Followers,3.0,"The place is good but not great. The location is amazing, it’s right opposite to JWMarriot Juhu, which makes it perfect for a breezy evening.

Few things which we really loved was,
The idea of giving free water & chips… there is a story behind it and makes it an emotional touch.
The idea of coffee tasters, I guess it’s the first cafe I have been to which does that, really loved it.

Baked vadapav and the tiny butter croissant are must try.
Vietnamese frappe & Nariyal coffee frappe both were good but not great.
Other food items were also similar.

If you looking for breezy evening & hot coffee, please visit.",place good location right opposite jwmarriot makes perfect breezy things really loved idea giving free water story behind makes emotional idea coffee guess first cafe really loved baked vadapav tiny butter croissant must vietnamese frappe nariyal coffee frappe good food items also looking breezy evening hot please,Positive,"Food Quality, Location",Timing
KHILTI,0 reviews,1 Followers,4.0,"I visited a charming open café that offered both indoor ( less seats) and outdoor seating, creating a cozy yet refreshing vibe. What stood out the most was their thoughtful and generous service—I was welcomed with water in a canned bottle, complimentary banana chips, and later, a taster shot of the coffee I had ordered before the actual drink arrived. I absolutely loved this concept by the Ettara team, allowing a preview of the coffee experience. With its curated menu and warm atmosphere, this café is definitely going to be my new go-to spot!",visited charming open café offered indoor less outdoor creating cozy yet refreshing stood thoughtful generous welcomed water canned complimentary banana taster shot coffee ordered actual drink absolutely loved concept ettara allowing preview coffee curated menu warm café definitely going new,Positive,"Food Quality, Location",Timing
Aayush Jayswal,0 reviews,0 Followers,2.0,The coffees ordered were not good except the Caramel Frappe. But the banana chips on the side were excellent!!,coffees ordered good except caramel banana chips side,Positive,Food Quality,Location
410283,0 reviews,0 Followers,5.0,Amazing place. Must try the baked vada pav and filter coffee affogato.,amazing must try baked vada pav filter coffee,Positive,Food Quality,Food
Tanisha,0 reviews,0 Followers,3.0,Iced latte was very weak and milky but tasted good overall,iced latte weak milky tasted good overall,Positive,General,Location
Pooja Joshi,0 reviews,239 Followers,1.0,the cafe has outside seating and only 2 tables inside ..on a weekend there is waiting for a table ..I was sitting on a chair in a corner and the waiter very rudely asked me to get up n stand outside ..overpriced coffee which is mediocre in taste ..rude waiters with no manners,cafe outside seating tables inside weekend waiting table sitting chair corner waiter rudely asked get n stand outside coffee mediocre taste waiters manners,Negative,"Service, Food Quality, Timing",Service
Kirit Joshi,0 reviews,0 Followers,5.0,Nice restaurant and friendly staff and owner . more than value for money for products they serve to customers with atmost care and customised taste ...,nice restaurant friendly staff owner value money products serve customers atmost care customised taste,Positive,Service,Food
Mitesh Shah,0 reviews,1 Followers,5.0,"I had an absolutely amazing experience! The coffee was outstanding - rich, smooth, and full of flavor. The ambient was cozy and inviting, making it the perfect spot to relax and unwind. But what really made our visit stand out was the service the staff were friendly, attentive, and knowledgeable about their products.

But the best part of our experience was the fact that they offered us a taste before serving our drinks. This showed that they were truly committed to ensuring that we got the perfect cup of coffee, and it made all the difference. The attention to detail and care that they put into every aspect of our visit was impressive, and we left feeling thoroughly satisfied and...read more",absolutely amazing coffee outstanding full ambient cozy making perfect spot relax really made visit stand service staff knowledgeable best part experience fact offered us taste serving showed truly committed ensuring got perfect cup made attention detail care put every aspect visit left feeling thoroughly satisfied,Positive,"Service, Food Quality, Location",Food
Pinkesh Jain,0 reviews,0 Followers,5.0,Best coffee better den starbucks n nice services asif sir,best coffee better den starbucks n nice services asif sir,Positive,"Service, Food Quality",Food
Gaurav,0 reviews,0 Followers,5.0,"It was amazing! The vibe,the coffee! The raviollliiiii! Amazing! The service was good! They made us taste coffee before pouring it! Asi was an amazing guy! 10/10 will highly recommend!",service made us taste coffee pouring asi amazing highly,Positive,"Service, Food Quality",Service
Aritri Bhattacharyya,0 reviews,3 Followers,5.0,You get free banana chips!!! And the coffee was way too good than i expected. The packaging was impressive. Overall experience 11/10.,get free banana coffee way good packaging overall experience,Positive,Food Quality,Timing
Dishant Chavan,0 reviews,58 Followers,5.0,"Coffee was good, we tried the cake which was also excellent, service by Asif was 5 star, he was helpful with the options and always had smile on his face.",coffee tried cake also service asif helpful options always smile,Positive,"Service, Food Quality",Service
Lucky,0 reviews,0 Followers,3.0,Kareem is very kind efficient and good in his work! i really like his attitude and behaviour towards the people he serves 🧿✨🪬🌞👌🏻,kareem kind efficient good really like attitude behaviour towards people serves,Positive,General,Timing
Name,Reviews Count,Followers,,Review Text,review text,Neutral,Location,Timing
Lucky,0 reviews,0 Followers,3.0,Kareem is very kind efficient and good in his work! i really like his attitude and behaviour towards the people he serves 🧿✨🪬🌞👌🏻,kareem kind efficient good really like attitude behaviour towards people serves,Positive,General,Timing
Name,Reviews Count,Followers,,Review Text,review text,Neutral,Location,Timing
Lucky,0 reviews,0 Followers,3.0,Kareem is very kind efficient and good in his work! i really like his attitude and behaviour towards the people he serves 🧿✨🪬🌞👌🏻,kareem kind efficient good really like attitude behaviour towards people serves,Positive,General,Timing
Name,Reviews Count,Followers,,Review Text,review text,Neutral,Location,Timing
Lucky,0 reviews,0 Followers,3.0,Kareem is very kind efficient and good in his work! i really like his attitude and behaviour towards the people he serves 🧿✨🪬🌞👌🏻,kareem kind efficient good really like attitude behaviour towards people serves,Positive,General,Timing
Lucky,0 reviews,0 Followers,3.0,Kareem is very kind efficient and good in his work! i really like his attitude and behaviour towards the people he serves 🧿✨🪬🌞👌🏻,kareem kind efficient good really like attitude behaviour towards people serves,Positive,General,Timing
Lucky,0 reviews,0 Followers,3.0,Kareem is very kind efficient and good in his work! i really like his attitude and behaviour towards the people he serves 🧿✨🪬🌞👌🏻,kareem kind efficient good really like attitude behaviour towards people serves,Positive,General,Timing
Lucky,0 reviews,0 Followers,3.0,Kareem is very kind efficient and good in his work! i really like his attitude and behaviour towards the people he serves 🧿✨🪬🌞👌🏻,kareem kind efficient good really like attitude behaviour towards people serves,Positive,General,Timing
Lucky,0 reviews,0 Followers,3.0,Kareem is very kind efficient and good in his work! i really like his attitude and behaviour towards the people he serves 🧿✨🪬🌞👌🏻,kareem kind efficient good really like attitude behaviour towards people serves,Positive,General,Timing
Lucky,0 reviews,0 Followers,3.0,Kareem is very kind efficient and good in his work! i really like his attitude and behaviour towards the people he serves 🧿✨🪬🌞👌🏻,kareem kind efficient good really like attitude behaviour towards people serves,Positive,General,Timing
Lucky,0 reviews,0 Followers,3.0,Kareem is very kind efficient and good in his work! i really like his attitude and behaviour towards the people he serves 🧿✨🪬🌞👌🏻,kareem kind efficient good really like attitude behaviour towards people serves,Positive,General,Timing
Lucky,0 reviews,0 Followers,3.0,Kareem is very kind efficient and good in his work! i really like his attitude and behaviour towards the people he serves 🧿✨🪬🌞👌🏻,kareem kind efficient good really like attitude behaviour towards people serves,Positive,General,Timing
Name,Reviews Count,Followers,,Review Text,review text,Neutral,Location,Timing
Lucky,0 reviews,0 Followers,3.0,Kareem is very kind efficient and good in his work! i really like his attitude and behaviour towards the people he serves 🧿✨🪬🌞👌🏻,kareem kind efficient good really like attitude behaviour towards people serves,Positive,General,Timing
Dishti Patel,0 reviews,0 Followers,5.0,Asif shaikh provided excellent service. It felt like a 5 star hotel with the exceptional service and ambience. The baked vada pav was great and the coffee was excellent.,asif shaikh provided excellent felt like star hotel exceptional service baked vada pav great coffee,Positive,"Service, Food Quality",Food
Vikhyat Nanda,0 reviews,1 Followers,5.0,"One of the best coffee shops in Mumbai. Friendly staff, good coffee and cute ambience and superb location. It's a bit small but amazing nonetheless. Must visit.",one best coffee shops friendly good coffee cute ambience superb bit small amazing must,Positive,"Service, Food Quality, Location",Service
Vania Khatri,0 reviews,0 Followers,5.0,"It has a small cafe atmosphere. Which is literally the only thing I can say good about it.

Take 45 minutes for Filter coffee (for real)
The banana chips are a good touch
Don’t go there for the coffee or service or the food .

For a quick coffee and snack . Definitely avoid .",small cafe literally thing say good take minutes filter coffee banana chips good touch go coffee service food quick coffee snack definitely avoid,Positive,"Service, Food Quality, Timing",Service
Gunjan Singh,0 reviews,0 Followers,5.0,Asif has helped us alot and suggested good food,asif helped us alot suggested good food,Positive,Food Quality,Service
Tanvi Panpalia,0 reviews,0 Followers,4.0,the vada pav was not hot,vada pav hot,Positive,General,Food
Nandini Sharma,0 reviews,0 Followers,4.0,"This place has always been one of my favorite spots to chill, thanks to its amazing food and inviting ambiance. However, it has become quite crowded recently, and the waiting time has stretched to over 35 minutes. While most of the staff are friendly and accommodating, one particular staff member came across as a bit rude. Despite this, the food continues to be exceptional, making it a go-to destination for me.",place always one favorite spots thanks amazing food inviting become quite crowded waiting time stretched staff friendly one particular staff member came across bit despite food continues making destination,Positive,"Service, Food Quality, Timing, Location",Service
AD B,0 reviews,2 Followers,4.0,"Food and beverages and service is both exceptional and Consistant.
I prefer it to Starbucks and all other coffee chains I have visited.
Infact when I am in Juhu, this is the only place I visit. And when I am not in Juhu.. I Tey to swing by Juhu despite the terrible Juhu traffic.",food beverages service exceptional prefer starbucks coffee chains infact place tey swing juhu despite terrible juhu,Negative,"Service, Food Quality, Location",Service
Roselina Fernandes,0 reviews,1 Followers,4.0,"it's situated at a place for those who feel tired after a walk on the beach to have a sip of coffee and delighted chips from Kerala. The restaurant follows its tradition and the water they serve, don't forget to read its description.",situated place feel tired walk beach sip coffee delighted chips restaurant follows tradition water forget read,Positive,"Food Quality, Location",Food
Alfarid Mulla,0 reviews,18 Followers,4.0,"Everything about this cafe is good, their coffee and their dessert is something interesting and unique. Service is good, especially Asif, he is confident and kind.",everything cafe coffee dessert something interesting service especially confident,Positive,"Service, Food Quality",Service
Yayin Pathak,0 reviews,0 Followers,5.0,"Love the concept
Food menu is really interesting
Service by Asif was good",love concept food menu really interesting service asif good,Positive,"Service, Food Quality",Service
Payal Suvanam,0 reviews,6 Followers,5.0,"Asif / Sonalika

Thank you an awesome service . These guys were just amazing.
Thank you for an excellent experience first time was just great 🤩🤩🤩🤩🤩",asif sonalika thank awesome service guys thank excellent experience first time great,Positive,Service,Service
Ayushi Mittal,0 reviews,0 Followers,5.0,,nan,Neutral,General,Food
Dolly Singhvi,0 reviews,5 Followers,5.0,"Everything I ordered was delicious
Iced mocha 5/5
Baked vada pav 5/5
Mysore pak cheesecake 6/5 (very delicious)
Water bottle was the best 😅
Loved the detailings
Staff is very courteous 🫶",everything ordered delicious iced mocha baked vada pav mysore pak cheesecake water bottle best loved detailings staff courteous,Positive,"Service, Food Quality",Food
Shaan,0 reviews,3 Followers,5.0,Priti is very nice :) food was also great :),priti nice food also great,Positive,Food Quality,Service
Ishita Gandhi,0 reviews,1 Followers,5.0,,nan,Neutral,General,Food
Minal Sharma Vadodaria,0 reviews,2 Followers,5.0,I live behind & it’s my go to place for coffee or a quick meet. Their baked vada pav are yummy along with all the nice small treats. I just wish it was bigger place where I could come and work. Sharing a photo with my take away coffee enjoyed with sunrise. Love it! 🫶❤️,live behind go place coffee quick baked vada pav yummy along nice small wish bigger place could come sharing photo take away coffee enjoyed love,Positive,"Food Quality, Timing, Location",Food
Puneet Agarwal,0 reviews,0 Followers,5.0,delivery guy shankar really nice,delivery guy shankar really nice,Positive,General,Service
Param Detroja,0 reviews,0 Followers,5.0,Best coffee place ever and the staff improves the experience of your coffee. Love it!!!,best coffee place ever staff improves experience love,Positive,"Service, Food Quality, Location",Service
Jasmin,0 reviews,0 Followers,5.0,Best coffee,best coffee,Positive,Food Quality,Service
Jeel,0 reviews,0 Followers,5.0,"Really fair priced, super cozy ambience, baked vada pao is a must try here",really fair super cozy baked vada pao must try,Positive,Location,Food
Manav Makhija,0 reviews,85 Followers,5.0,"The place is my all time fav🫶🏻
Today even when the place was full the staff made sure that we get the table, and made sure we are comfortable. Special mention for Asif, who really made us feel warm and comfy, thanks to him",place time today even place full staff made sure get made sure special mention really made us feel warm thanks,Positive,"Service, Location",Food
Nandini Wagle,0 reviews,1 Followers,5.0,Great coffee and ambience! Asif helped us and made our experience so much better. Please do visit and have a taste of their menu 10/10 recommend!!,great coffee asif helped us made experience much please visit taste menu,Positive,Food Quality,Location
Harshika,0 reviews,0 Followers,5.0,Very good coffee and service by asif,good coffee service asif,Positive,"Service, Food Quality",Service
Kanishka Porwal,0 reviews,0 Followers,5.0,Asif and sonalika are amazing and very helpful,asif sonalika amazing helpful,Positive,General,Service
Ayushi Mittal,0 reviews,0 Followers,5.0,The coffee and vibe of the space is really good asif served really well,coffee vibe space really good asif served really well,Positive,Food Quality,Service
Heesha Panchal,0 reviews,0 Followers,5.0,"great experience, good coffee and service by asif",great good coffee service asif,Positive,"Service, Food Quality",Service
Sahely,0 reviews,3 Followers,5.0,Coffee was really good. Asif's service was great.,coffee really service,Positive,"Service, Food Quality",Service
Anup Kulkarni,0 reviews,266 Followers,5.0,A nice little place for coffee. The menu is full of international coffees with a South Indian twist. And the service is also great. Asif was quick to serve us and suggest good coffees. A must go for coffee lovers,nice little place menu full international coffees south indian service also asif quick serve us suggest good must go coffee lovers,Positive,"Service, Food Quality, Timing, Location",Service
Dhwani,0 reviews,0 Followers,5.0,Asif bhai had such a wonderful vibe- he served us with such warmth. Excellent coffee. Good ambience.,asif bhai wonderful served us excellent good,Positive,General,Service
Rasheedul Haq,0 reviews,1 Followers,5.0,Asif was really very helpful and friendly with the order and the service,asif really helpful friendly order service,Positive,Service,Service
Vedant,0 reviews,1 Followers,5.0,"Asif provided excellent service, and the food, particularly the Mushroom edemunchi croissant, was outstanding.",asif provided excellent particularly mushroom edemunchi,Positive,General,Service
Natasha Malhotra,0 reviews,0 Followers,5.0,"Very good quality coffee , service and snacks !!!!",good quality coffee service snacks,Positive,"Service, Food Quality",Service
Satish Bhatia,0 reviews,1 Followers,5.0,sonalika was great n patient guiding exotic menu,sonalika great n patient guiding exotic menu,Positive,General,Location
Shivam Dodai,0 reviews,1 Followers,5.0,Great place. Asif was helpful,great asif helpful,Positive,General,Service
Gursimar Kaur,0 reviews,0 Followers,5.0,"Loved the vibe here! The food was a 10/10, we were served by Asif who did an amazing job.",loved vibe food served asif amazing,Positive,Food Quality,Service
Agrawalpalak417,0 reviews,0 Followers,5.0,loved the service by asif. ettarra has always been my go to place.,loved service ettarra always go,Positive,Service,Service
Priyanka Tukadiya,0 reviews,288 Followers,5.0,Great service by Asif and good ambience to hang out and have comfortable drinks,great service asif good ambience hang comfortable drinks,Positive,"Service, Location",Service
Shashank Singh,0 reviews,1 Followers,5.0,"Asif’s hospitality, latte coffee and food. Everything about this place is truly amazing. ;)",latte coffee everything place truly,Neutral,"Food Quality, Location",Food
Ami Lodriya,0 reviews,6 Followers,5.0,Asif was really kind and suggested us to try their new best seller and we had a good time here. Do try,asif really kind suggested us try new best seller good time try,Positive,General,Service
Rushabh Sanghavi,0 reviews,1 Followers,1.0,"Staff is really good , asif helped us to choose the best coffee for us",staff really good asif helped us choose best coffee us,Positive,"Service, Food Quality",Service
Seeran Jain,0 reviews,0 Followers,1.0,Really good service by Asif,really good service asif,Positive,Service,Service
Hardik Mehta,0 reviews,0 Followers,1.0,"WHAT A PLACE! The food, the service, the ambiance. And value for money for real! Highly recommended. ALSO THE SERVICE BY ASIF BHAIYA, HANDS DOWN THE BEST SERVER!",value money highly also service asif hands best,Positive,Service,Service
Saransh Ahuja,0 reviews,100 Followers,1.0,"To sum it up - A waste of such good ambience and 24x7 coffee shop. A wish to have some great filter coffee outdoors in the middle of the night were squashed. The filter coffee was very bad. It was awful !! It’s an insult in the name of any coffee. Cycle wala Rs. 10 coffee is better than the filter coffee here. Plus my stomach has been upset since last night after having the coffee, must be the bad milk. Not only me , but my friends also felt the same. Never going back, you were a major disappointment",sum waste good ambience coffee wish great filter coffee outdoors middle night filter coffee awful insult name cycle wala coffee better filter coffee plus stomach upset since last night must bad friends also felt never going major disappointment,Negative,"Food Quality, Location",Location
Naitik,0 reviews,0 Followers,1.0,Rude staff,rude staff,Negative,Service,Location
Riya Agrawal,0 reviews,0 Followers,5.0,Ettara is always fun to visit. The ambiance and food is also good. Asif was very sweet while serving us,ettara always fun ambiance food also asif sweet serving us,Positive,Food Quality,Service
Mansi Agarwal,0 reviews,1 Followers,5.0,Asif was our server he is very polite and very helpful a must visit place if you are in Juhu,asif server polite helpful must visit place juhu,Neutral,"Service, Location",Service
Hetvi Desai,0 reviews,0 Followers,5.0,Asif made the best bon bon frappe,asif made best bon bon frappe,Positive,General,Service
Raj,0 reviews,0 Followers,5.0,"Asif, Loved the service",loved service,Positive,Service,Service
Sweta,0 reviews,64 Followers,5.0,"In one word, Impressive! it was a feel good experience with the delight of this Cafe's hospitality, ambience, the copper cutleries, wholesome baked banana wafers yumm!, the water packaging in glass bottle, the baked wada pav ....must try! pipen hot in mumbai winter nights... everything was perfect. coffee was well-brewed and perfect! the berliners were oh so yummy! it was a perfect evening well spent. Our server Asif was super helpful and hospitable to add smile to our visit.",one feel good experience delight copper wholesome baked banana wafers water packaging glass baked wada pav pipen hot mumbai winter everything coffee berliners oh perfect evening well server asif super helpful hospitable add smile,Positive,Food Quality,Food
Navya Kumar,0 reviews,0 Followers,5.0,Great service by Asif. Thanks Ettara,great service thanks ettara,Positive,Service,Location
Parth Pahuja,0 reviews,0 Followers,5.0,"Very good customer service, staff (Asif) was very humble",good customer staff humble,Positive,Service,Location
Taksha Goyal,0 reviews,0 Followers,5.0,"It was a great experience, came here 2-3 times but leaving a review for the first time. The service was amazing as well as the staff!!
Shout out to Asif, for fixing our drink!",great came times leaving review first service amazing well shout fixing,Positive,"Service, Location",Timing
Purti Mehra,0 reviews,1 Followers,5.0,"Loved the place and coffee!!! Our server, Asif was a great help at the restaurant",loved place asif great help restaurant,Positive,Location,Service
Divy Agrawal,0 reviews,0 Followers,5.0,Asif suggested the best coffee.,asif suggested best,Positive,General,Service
Akash,0 reviews,14 Followers,5.0,"very polite staff, Asif and amazing coffee",polite asif amazing coffee,Positive,"Service, Food Quality",Service
Manas Chabria,0 reviews,2 Followers,5.0,Asif is really amazing !!,asif really amazing,Positive,General,Service
Jaya Gangwani,0 reviews,1 Followers,5.0,"Such good coffee + Banana chips.
I would definitely visit to try more things.",good coffee banana would definitely visit try,Positive,Food Quality,Food
Sanjana Kotian,0 reviews,0 Followers,5.0,Good service by Priti,good service priti,Positive,Service,Timing
Tanmay Agrawal,0 reviews,0 Followers,5.0,Great service by Asif!,great service,Positive,Service,Service
Shrey Agarwal,0 reviews,1 Followers,5.0,Asif was great!,asif,Neutral,General,Service
Yash,0 reviews,0 Followers,5.0,Asif bhai was a great person and had impeccable serving etiquettes. Our group of friends have been regularly visiting this place for the vibe and variants of coffee being served here.,asif bhai great person impeccable serving group friends regularly visiting place vibe variants coffee served,Positive,"Food Quality, Location",Service
Zzzzzzz,0 reviews,1 Followers,5.0,Asif,asif,Neutral,General,Service
Vidhi Agarwal,0 reviews,0 Followers,5.0,amazing service by asif,amazing service asif,Positive,Service,Service
Sakshi Satardekar,0 reviews,0 Followers,5.0,Asif is great with his service. Great food,asif great great food,Positive,Food Quality,Service
Bhushan Dixit,0 reviews,0 Followers,5.0,ASIF,asif,Neutral,General,Service
Madhur,0 reviews,0 Followers,5.0,"Beautiful ambiance, delicious food, loved the experience. Asif helped us throughout the dining experience. Thanks to him!",beautiful delicious loved asif helped us throughout dining thanks,Positive,Food Quality,Location
Hetu Mehta,0 reviews,12 Followers,5.0,Great service by Asif!,great service,Positive,Service,Service
Hitesh Patel,0 reviews,0 Followers,5.0,Asif is great service,asif great service,Positive,Service,Service
Shreyan,0 reviews,300 Followers,5.0,,nan,Neutral,General,Food
Reyaansh Kataria,0 reviews,0 Followers,5.0,"Great staff , thanks to Asif bhai",great staff thanks asif bhai,Positive,Service,Service
Heth,0 reviews,0 Followers,5.0,Asif coperate and excellent staff,asif coperate excellent staff,Positive,Service,Service
