Name,Reviews_Count,Followers,Rating,Review,Processed_Review,Sentiment,Issue_Category,Topic
Sanket Rathod,0 reviews,77 Followers,5.0,"Ettarra is one of the best coffee places in mumbai and the only coffee place which is open 24x7.. Also Manoj Pandit is one of the best servers here, always ask for him to place your orders.",ettarra one best coffee places mumbai coffee place open also manoj pandit one best servers always ask place,Positive,"Food Quality, Location",Service
Nishit,0 reviews,0 Followers,5.0,"Ultimate service by the staff manoj bhai and very good behavior
Great south indian style filter coffee
Must try",ultimate service staff manoj bhai good behavior great south indian style filter coffee must try,Positive,"Service, Food Quality",Service
Sia Agarwal,0 reviews,0 Followers,5.0,Manoj/ Asif,asif,Neutral,General,Service
Rohit Khanwani,0 reviews,7 Followers,5.0,Manoj a very nice person proud of you and your service love youuu😘😘😘😘,manoj nice person proud service love,Positive,Service,Service
Bhavika,0 reviews,1 Followers,5.0,"This coffee shop offers welcoming atmosphere and friendly staff. The coffee is rich and flavourful. Also loved their lotus biscoff mousse… A perfect spot to enjoy this cool weather!


Asif shaikh was the best in service!",coffee shop offers welcoming atmosphere friendly coffee rich also loved lotus biscoff perfect spot enjoy cool asif shaikh best,Positive,"Service, Food Quality",Food
Maria Mathew,0 reviews,1 Followers,5.0,"Asif
good service
great place to relax",asif good service great place relax,Positive,"Service, Location",Service
Kavya Reddy,0 reviews,0 Followers,5.0,asif service was good and the ambience is great...,asif service good ambience,Positive,"Service, Location",Service
Kreamsy Bhuwariya,0 reviews,0 Followers,5.0,"The service was really good , so was the taste , Asif was very friendly",service really good taste asif friendly,Positive,Service,Service
Sneha Mundra,0 reviews,0 Followers,5.0,Asif provided a really good service,asif provided really good service,Positive,Service,Service
Devrnambiar King1975,0 reviews,1 Followers,5.0,Asif Bhai served us great coffee and great service,asif bhai served us great coffee great service,Positive,"Service, Food Quality",Service
Preet Mehta,0 reviews,0 Followers,5.0,Asif was a very nice person,asif nice person,Positive,General,Service
Yash Gada,0 reviews,2 Followers,5.0,Loved the coffee and Asif's service,loved coffee service,Positive,"Service, Food Quality",Service
Kartik Choudhary,0 reviews,3 Followers,5.0,Asim was a handful person. He helped with good recommendations and smooth serving. Enjoyed it!!,asim handful helped good recommendations smooth enjoyed,Positive,General,Timing
Nikunj Rele,0 reviews,95 Followers,5.0,"Great coffee, great food, great service. Especially by Asif. He took great care of us and was prompt, polite and made sure hospitality was amazing! Plus the place is pet friendly!",great great great especially took great care us polite made sure hospitality plus place pet,Positive,"Service, Location",Location
Ankit Kaul,0 reviews,4 Followers,5.0,"Great coffee and the best part is the free banana chips!

Good service by Asif, he made sure we had everything we needed.",great coffee best part free banana good service made sure everything,Positive,"Service, Food Quality",Location
Vishvesh Bhatt,0 reviews,20 Followers,5.0,"Amazing food... The vibe is cool...
Asif provided amazing service..
A must visit..",amazing vibe asif provided amazing must,Positive,General,Service
Juhi,0 reviews,0 Followers,5.0,"I love the place, must try!
Asif bhaiya served us very well!",love must asif bhaiya served us,Positive,General,Service
Hiren Shah,0 reviews,18 Followers,5.0,coffee and food is really good. Asif is very helpful for suggestions and services.,coffee food really asif helpful suggestions,Positive,Food Quality,Service
Esha Shah,0 reviews,0 Followers,5.0,"best coffee ever. should definitely give it a try
great service by manoj and asif",best coffee definitely give try great service manoj asif,Positive,"Service, Food Quality",Service
Diya Shah,0 reviews,1 Followers,5.0,Asif and Manoj were really good servers love the place,asif manoj really good servers love place,Positive,Location,Service
Anirudh Dhelia,0 reviews,0 Followers,5.0,thr coffee was great and the server Asif was also great.,thr coffee great server asif also,Positive,Food Quality,Service
Mr. Kartikey Rohilla,0 reviews,0 Followers,5.0,"Very happening place, and an amazing service by Asif.",happening amazing service,Positive,Service,Service
Piyush Sutariya,0 reviews,6 Followers,5.0,"Asif explained all coffee, with best of food available. Excellent coffee!! Great place ro visit.",asif explained best food excellent great place ro,Positive,"Food Quality, Location",Service
D Patel,0 reviews,1 Followers,5.0,"Asif took excellent care of understanding the coffee choice and suggested best out of the one available.
Would surely suggest this place.",asif took excellent care understanding coffee choice suggested best one would surely suggest,Positive,Food Quality,Food
Darsh Suchak,0 reviews,0 Followers,5.0,It was an amazing experience as always with Asif!,amazing experience always,Positive,General,Service
Ritul,0 reviews,0 Followers,5.0,loved the coffee and the service by Asif sir! The behaviour of staff is very friendly and loved the vibe. Must visit,loved coffee service asif behaviour staff friendly loved must visit,Positive,"Service, Food Quality",Service
Yasmeen,0 reviews,0 Followers,5.0,Itna late order aata hai aur thanda hota hai sub food.. very disappointing,itna late order aata hai aur thanda hota hai sub disappointing,Negative,General,Food
Yash Shah,0 reviews,38 Followers,5.0,Thanks to Asif shaikh for serving hot chocolate and firecracker croissants!,thanks asif shaikh serving hot chocolate firecracker,Positive,General,Service
Naman Jain,0 reviews,3 Followers,5.0,Aasib served us well!,aasib served us,Neutral,General,Location
Aasthad171,0 reviews,20 Followers,5.0,The food options are a limited but the coffee is great and our server Asib was lovely!,food options limited coffee great server asib,Positive,Food Quality,Service
Muskan Mittal,0 reviews,0 Followers,5.0,Wonderful service by Asif! Absolutely loved the experience,wonderful service absolutely loved experience,Positive,Service,Service
Dev Kumar,0 reviews,0 Followers,5.0,"Asif, great food loved it",great food loved,Positive,Food Quality,Service
Kaavya Maheshwari,0 reviews,0 Followers,5.0,Great coffee and food. Outdoor sitting in the evening is lovely. Asif our waiter was great too.,great coffee outdoor sitting evening asif waiter great,Positive,"Service, Food Quality",Location
Rahul Gunda,0 reviews,0 Followers,5.0,"A great pick for coffee lovers looking for something cool and invigorating.The south Indian coffee essence adds a unique twist.
The service provided by Asif was exceptional...attentive,polite and ensured had a comfortable experience throughout😀",great pick coffee lovers looking something cool south indian coffee essence adds unique service provided asif ensured comfortable experience,Positive,"Service, Food Quality",Service
Himanshi,0 reviews,0 Followers,5.0,,nan,Neutral,General,Food
Priyamvada Bagla,0 reviews,4 Followers,5.0,Fabulous service by Asif!,fabulous service,Positive,Service,Service
Aman Singh,0 reviews,0 Followers,5.0,Service was very good by Mr.Asif shaikh,service good shaikh,Positive,Service,Service
Bhavesh Rohra,0 reviews,0 Followers,5.0,"Great place, great food. Aasif was very polite, provided excellent service.",great great aasif provided excellent,Positive,General,Service
Diana Driver,0 reviews,17 Followers,5.0,asif,asif,Neutral,General,Service
Yuthika Patil,0 reviews,1 Followers,5.0,great coffee and amazing service by asif! highly recommend having coffee and the mushroom croissant here,great coffee amazing service highly recommend coffee mushroom croissant,Positive,"Service, Food Quality",Service
Suhani,0 reviews,0 Followers,5.0,Asif Shaikh is good 😊,asif shaikh good,Positive,General,Service
Vishal Pathak,0 reviews,0 Followers,5.0,asif shaikh he is very good guys good experience on this caff,asif shaikh good guys good experience caff,Positive,General,Service
Neha Kaushik,0 reviews,0 Followers,5.0,"Asif , waiter served very well in this cafe",asif waiter served well cafe,Neutral,Service,Service
Rakshita Jangid,0 reviews,0 Followers,5.0,Asif is really good server.,asif really good,Positive,General,Service
Shaurya Goyal,0 reviews,0 Followers,5.0,Asif sheik very good behaviour and excellent food and drinks,asif sheik good behaviour excellent food drinks,Positive,Food Quality,Service
Khushi,0 reviews,0 Followers,5.0,"Beautiful ambience with amazing food & amazing people. Asif shaikh is very polite & generous. Love the placeee overall, must visit",beautiful ambience amazing food amazing asif shaikh polite love placeee must visit,Positive,"Service, Food Quality, Location",Service
Dhananjay Zaveri,0 reviews,0 Followers,5.0,Asif helped us a lot and he’s a great guy with great skills and provides lot of comfort and help during whole exp in ttarra,asif helped us lot great guy great skills provides lot comfort help whole exp ttarra,Positive,General,Service
S,0 reviews,0 Followers,5.0,Amazing coffee & even better service by asif,amazing coffee even better service asif,Positive,"Service, Food Quality",Service
Bhrigu Bhargava,0 reviews,0 Followers,5.0,"Asif Sheikh
I liked the coffee and ambience. Also, the staff was very sweet and corporative",asif sheikh liked coffee staff sweet corporative,Positive,"Service, Food Quality",Location
Divij Sethi,0 reviews,3 Followers,5.0,Very good service by Asif sheikh,good service asif sheikh,Positive,Service,Service
Rishabh Gigras,0 reviews,1 Followers,5.0,Great service by Asif Shaikh,great service asif shaikh,Positive,Service,Service
Ali Naqi,0 reviews,0 Followers,5.0,Asif is too good at his services,asif good services,Positive,Service,Service
Gagan Poddar,0 reviews,1 Followers,5.0,"Great coffee, great service, polite staff(Asif)✌️",great great polite,Positive,Service,Location
Khushi,0 reviews,8 Followers,5.0,"Asit shaikh

very good service",asit shaikh good service,Positive,Service,Service
Payal Mahana,0 reviews,0 Followers,5.0,Lovely ambience and great hospitality by Asif Shaikh,lovely ambience great hospitality asif shaikh,Positive,Location,Location
Aditya Soni,0 reviews,0 Followers,5.0,"Asif

“A delightful haven for coffee enthusiasts! The aroma pulls you in, the rich, perfectly brewed coffee warms your soul, and the cozy ambiance makes you never want to leave. A must-visit spot for pure coffee bliss!”",asif delightful coffee aroma pulls perfectly brewed coffee warms cozy ambiance makes never want spot pure coffee,Positive,"Food Quality, Location",Food
Mehak Sharma,0 reviews,0 Followers,5.0,"Asif Shaikh was incredibly kind and helpful throughout my experience at ETTARRA. After visiting, I would choose ETTARRA over Starbucks or Tim Hortons any day. The entire experience is unlike any other coffee shop. It's more than just a place to get coffee; it's an immersive experience. The water initiative concept, combined with the warm hospitality of the owner and staff, is truly commendable.",asif shaikh incredibly kind helpful throughout experience would choose ettarra starbucks tim hortons entire experience unlike coffee place get immersive water initiative combined warm hospitality owner truly,Positive,"Food Quality, Location",Service
Seeza,0 reviews,0 Followers,5.0,Original taste with quality. Perfect desert option after lunch and dinner.,original taste perfect desert option lunch,Positive,General,Location
Vignesh Chandrasekaran,0 reviews,2 Followers,5.0,"The ambience of the place is really good. Service and support of the staff, Mr Asif Sheik was very opulent. The cappuccino offered was really superb. Would suggest to visit after 10pm. And specially during winters the outside seating is awesome!!",ambience place really service support mr asif sheik cappuccino offered really would suggest visit specially winters outside seating,Positive,"Service, Location",Service
Hritik,0 reviews,0 Followers,5.0,"The place is worth a visit, food is drool worthy and asif was very helpful.",place worth food drool worthy asif,Positive,"Food Quality, Location",Service
Narkar Digambar,0 reviews,0 Followers,5.0,Visit errata friend service staff beatiful ambience #asifshaikh gave an amazing service thanks,visit errata friend service staff beatiful ambience gave amazing service thanks,Positive,"Service, Location",Service
Hrithik,0 reviews,0 Followers,5.0,Asif Shaikh served well.,asif shaikh served,Neutral,General,Service
Urvi,0 reviews,0 Followers,5.0,Excellent coffee and ambience. Very good service by Aseem Sheikh!,excellent coffee good service aseem,Positive,"Service, Food Quality",Service
Ajay Raj,0 reviews,1 Followers,5.0,"Asif at Ettara is great at his work, and I must say, his service was absolutely excellent! Asif always make sure I felt welcome and well taken care of. His friendly attitude really made the experience stand out. Highly recommend! In any case, Ettara is a great place to be at",asif ettara great must service absolutely asif always make sure felt welcome well taken care friendly attitude really made experience stand highly ettara great place,Positive,"Service, Location",Location
Rishita Desai,0 reviews,26 Followers,5.0,Nice coffee and service is also best by Mr. Ashif and Ms. Sonalika. 👍,nice coffee service also best ashif,Positive,"Service, Food Quality",Service
Shreya Agrawal,0 reviews,0 Followers,5.0,Was served by Asif and he was great. Love love the ambience.,served asif love love,Positive,General,Service
Monil Gheewala,0 reviews,4 Followers,5.0,"Asif/Sonalika

Excellent Coffee, Good Hygiene, Personlised service … Perfect Hangout place.

I have been regular here since few months and won’t switch. Good part is 24 x 7 operational.

Best option for my early morning coffee and Me time 🤩

Thank you team Ettarra",excellent good personlised service perfect hangout regular since months good part x best option early morning coffee time thank team ettarra,Positive,"Service, Food Quality",Food
Chets,0 reviews,1 Followers,5.0,"*5/5 Stars*

I recently visited ettarra and was blown away by the exceptional coffee and warm atmosphere! The person who made my coffee Asif Shaikh is knowledgeable and makes the coffee just the way I love

The shop itself is cozy and inviting, with plenty of seating and natural light.

Overall, I highly recommend ettarra to anyone looking for a top-notch coffee experience.

*Rating Breakdown*

- Quality of Coffee: 5/5
- Atmosphere: 5/5
- Service: 5/5
- Value: 5/5",recently visited ettarra blown away exceptional coffee warm person made coffee asif shaikh knowledgeable makes coffee way love shop cozy plenty seating natural highly recommend ettarra anyone looking coffee quality,Positive,"Food Quality, Location",Service
Jyoti Sharma,0 reviews,0 Followers,5.0,asif shak i really like the satra cascara ice tea and the asif is good,asif shak really like satra cascara ice tea asif good,Positive,General,Service
Stuti Modi,0 reviews,1 Followers,5.0,Asif Shaikh is helpful and treat their customers well,asif shaikh helpful treat customers well,Neutral,General,Service
Shubham Shah,0 reviews,1 Followers,5.0,Asif Shaikh nice and polite person good service,asif shaikh nice polite person good service,Positive,Service,Service
Mithilesh,0 reviews,153 Followers,5.0,Aasif was very courteous and excellent service and good,aasif courteous excellent service good,Positive,Service,Service
Jigar,0 reviews,0 Followers,5.0,"Very good service.
Good Suggestions from Asif sheikh

Had a wonderful evening",good good suggestions asif sheikh wonderful evening,Positive,General,Service
Dharun Vij,0 reviews,0 Followers,5.0,asif shaikh served us very well,asif shaikh served us well,Neutral,General,Service
Jatin Sharma,0 reviews,0 Followers,5.0,Greatt coffee and wonderful service Asif and Sonalika ♥️,greatt coffee wonderful service asif sonalika,Positive,"Service, Food Quality",Service
Kashish Manglani,0 reviews,0 Followers,5.0,Amazing service and coffee…Asif Shaikh served us well…..,amazing service shaikh served us,Positive,Service,Service
Abhishek,0 reviews,1 Followers,5.0,Asif shaikh provided us the best service and chewy brownie is too die for.,asif shaikh provided us best service chewy brownie die,Positive,Service,Service
Sowmya Bali,0 reviews,58 Followers,5.0,"Whenever i visit thIs cafe , We are always treated very well by the staff . Today Asif Shaikh Took very good care of us . He was very Respectful , and did not take a minute to help us whenever Anything was needed. Thanks much .",whenever visit cafe always treated well staff today asif shaikh took good care us respectful take minute help us whenever anything thanks much,Positive,Service,Service
Sonechak@gmail.com,0 reviews,0 Followers,5.0,Asif shaikh was a great server the food was very good,asif shaikh great server food good,Positive,Food Quality,Service
Siddhata Deshmukh,0 reviews,5 Followers,5.0,"it was my first time at ettara nd Asif Sheikh recommended me South Indian Frappe , it was Bang On , loved his recommendation and the overall vibe",first time ettara nd asif sheikh recommended south indian frappe bang loved recommendation overall vibe,Positive,General,Food
Manak Kashyap,0 reviews,0 Followers,5.0,Amazing restaurant and service by Asif ♥️,amazing restaurant service asif,Positive,Service,Service
Parvatish Pradeep,0 reviews,4 Followers,5.0,"Really nice ambience and staff.
Lookout for the most adorable and sweetest staff member ever Sonalika.",really nice ambience lookout adorable sweetest staff member ever,Positive,"Service, Location",Service
Akash Jain,0 reviews,0 Followers,5.0,Asif shaikh helps us with choosing great coffee,asif shaikh helps us choosing great coffee,Positive,Food Quality,Service
Kinjubaby,0 reviews,0 Followers,5.0,sonalika and Asif awesome.... there recommendation and warmth was just perfect ... a perfect stop to hangout,sonalika asif recommendation warmth perfect perfect stop hangout,Positive,General,Food
Himanshi,0 reviews,0 Followers,5.0,Asif shaikh was very excellent in the service and overall it’s the best experience,asif shaikh excellent service overall best experience,Positive,Service,Service
Dhruv Gulati,0 reviews,0 Followers,5.0,Asif shaikh was very polite and humble person,asif shaikh polite humble person,Negative,Service,Service
Lokashi Singh,0 reviews,0 Followers,5.0,Great service by Mr Asif,great service mr asif,Positive,Service,Service
Aditi,0 reviews,2 Followers,5.0,Very tasty coffee. Asif was very helpful in guiding us with the menu helping us make the right choice,tasty asif helpful guiding us menu helping us make right choice,Positive,Food Quality,Location
Navika !,0 reviews,0 Followers,5.0,"Love the service, prabhav and aasif specially",love prabhav aasif specially,Positive,General,Timing
Harshini Sreedhara,0 reviews,0 Followers,5.0,"Asif Shaikh was my waiter he gave me amazing service, good coffee better than Starbuck or third wave. A good vibe place",asif shaikh waiter gave amazing good coffee better starbuck third good vibe place,Positive,"Service, Food Quality, Location",Service
Arnav Abhyankar,0 reviews,1 Followers,5.0,Very good coffee menus and excellent host Mr Asif ji.,good coffee menus excellent host mr asif,Positive,Food Quality,Service
Cannonball Zee,0 reviews,0 Followers,5.0,Asif sheikh and team is very hardworking and is very helpful,asif sheikh team hardworking helpful,Neutral,General,Service
Ami,0 reviews,0 Followers,5.0,Very good coffee and great service by Asif Sheikh,good coffee great service asif sheikh,Positive,"Service, Food Quality",Service
Shria Bookseller,0 reviews,0 Followers,5.0,wonderful service provided by asif!! And the food was good too!!,wonderful service provided food good,Positive,"Service, Food Quality",Service
Yuval Jhaveri,0 reviews,0 Followers,5.0,nice food and good service by asif,nice food good service asif,Positive,"Service, Food Quality",Service
Yuvraj Shah,0 reviews,35 Followers,5.0,"Really good coffee and something unique with a South Indian taste, great service by Asif shaikh. A fun vibe and good pricing.",really good coffee something unique south indian great service asif fun vibe good,Positive,"Service, Food Quality",Service
Rohan,0 reviews,1 Followers,5.0,Excellent service by Asif sheikh! Thanks asif,excellent service asif thanks asif,Positive,Service,Service
Niah,0 reviews,0 Followers,5.0,Asif shaikh amazing service,asif shaikh amazing service,Positive,Service,Service
WellWisher,0 reviews,36 Followers,5.0,"Asif shaik you are best host, i and my friend sam had come to take just filter coffee but his service and way of talking was really nice, took another cup of coffee. Best team work✨👍",asif shaik best friend sam come take filter coffee service way talking really took another cup best team,Positive,"Service, Food Quality",Service
Mihir Grover,0 reviews,0 Followers,5.0,Asif Shaikh ji was amazing and accompanied all our requests diligently.,asif shaikh ji amazing accompanied requests,Positive,General,Service
Aryan Kulkarni,0 reviews,0 Followers,5.0,Asif was extremely helpful and the food was excellent.,asif extremely helpful food,Negative,Food Quality,Service
Kaunchi Jain,0 reviews,0 Followers,5.0,Asif was extremely helpful and the service along with the food was exquisite.,asif extremely helpful service along food,Negative,"Service, Food Quality, Timing",Service
Meesha Bakhru,0 reviews,3 Followers,5.0,Perfect coffee..amazing service..Mr asif went out of his way to arrange the banana chips for me and served us very well,perfect asif went way arrange banana chips served us well,Positive,General,Location
Soumya Radhakrishnan,0 reviews,0 Followers,5.0,ASIF SHAIKH is one of my fav ..give the best service all the time,asif shaikh one fav best service time,Positive,Service,Service
Mridul Khaitan,0 reviews,0 Followers,5.0,A cozy place to have fun with friends. Amazing service. Enjoyed being served by Asif Shaik . Would recommend coming here,cozy place fun amazing enjoyed served asif shaik would recommend coming,Positive,Location,Service
Khushi,0 reviews,2 Followers,5.0,Asif shek was really polite about the order nice ambiance amizing place,asif shek really polite order nice ambiance amizing place,Positive,"Service, Location",Service
Tanya Wasir,0 reviews,9 Followers,5.0,The South Indian frappe is so good! Asi was very kind and helpful.,south indian frappe asi kind,Positive,General,Food
Manan Sanganeria,0 reviews,0 Followers,5.0,Asif really served us well,asif really served us well,Positive,General,Service
Tanvi Killa,0 reviews,0 Followers,5.0,Asif - amazing service,asif amazing service,Positive,Service,Service
Delrish,0 reviews,0 Followers,5.0,Asif’s service was great!!,service,Neutral,Service,Service
Vaishnavi,0 reviews,0 Followers,5.0,"Nice place, great experience , Asif did a great job",nice great experience asif great job,Positive,General,Service
Yashvika Mehrotra,0 reviews,0 Followers,5.0,"Had the most amazing time at Ettarra. Love the vibes, the hot chocolate and the hospitality. Mr Asif helped me have a delightful experience.",amazing time love hot chocolate mr asif helped delightful,Positive,General,Location
Jaya Chandawat,0 reviews,0 Followers,5.0,Asif Shaikh is really sweet. He served us well :),asif shaikh really served us well,Positive,General,Service
Pratyush,0 reviews,0 Followers,5.0,"It was lovely having coffee here and especially Asif served us with a smile, always!",lovely coffee especially asif served us,Positive,Food Quality,Location
Saisha Matta,0 reviews,0 Followers,5.0,Asif shaik is a really sweet person he helped us on our visit. Do check out the place highly recommended,asif shaik really sweet person helped us check place highly recommended,Positive,Location,Service
Fenila Gala,0 reviews,98 Followers,5.0,Lovely place n very good options for coffee lovers ..,lovely place n good options coffee lovers,Positive,"Food Quality, Location",Service
Malav Vinay Mehta,0 reviews,0 Followers,5.0,yummm,yummm,Neutral,General,Location
Vidhi Mody,0 reviews,1 Followers,5.0,"Asif shaikh was too kind and sweet, such Hearst service, always a great experience.",asif shaikh kind hearst always great,Positive,General,Service
Vinsu,0 reviews,0 Followers,5.0,Service from Asif was brilliant,service asif brilliant,Positive,Service,Service
Nilay Bagadia,0 reviews,93 Followers,5.0,"Great service from Asif and as always, perfect coffee and snacks! Absolutely reasonable and highly recommended!",great service asif perfect coffee absolutely reasonable highly,Positive,"Service, Food Quality",Service
Misba Khan,0 reviews,0 Followers,5.0,One of the amazing place to hangout with frnds……ASIF SHAIKH is the best and make sure to give his best service all the time ……thanks alot fr the best servive,one amazing place hangout shaikh best make sure give best service time alot fr best servive,Positive,"Service, Location",Service
Kasturi,0 reviews,0 Followers,5.0,one of my favorite 😍 ASIF SHAIKH always make sure to give his best sevice.....feel like home ❤️,one favorite asif shaikh always make sure give best like home,Positive,General,Food
Vrushti Shah,0 reviews,1 Followers,5.0,"The coffee and vibe over here is amazing. The service by Asif was too good. + I had the kappicuino which tastes really good.
The kaccha nimbu tart is a must try.",coffee vibe service asif kappicuino tastes really kaccha nimbu tart must,Positive,"Service, Food Quality",Service
Sonia Shah,0 reviews,0 Followers,5.0,"Love everything about this place! Asif Shaikh made us feel comfortable and suggested amazing things to try from the menu! A must visit, very rare cafe’s like this exist in mumbai!!",love everything asif shaikh made us feel comfortable suggested amazing things try must rare like exist,Positive,General,Service
